{
  "counts": {
    "false_negative": 2,
    "false_positive": 1,
    "true_positive": 8
  },
  "extractor_version": "regex-v1",
  "gold_snapshot_hash": "dddddddddddddddddddddddddddddddddddddddddddddddddddddddddddddddd",
  "metrics": {
    "f1": 0.842105,
    "precision": 0.888888,
    "recall": 0.8
  },
  "schema_version": "v13.extraction_evaluation.v1"
}
